[
  {
    "spelling": "again",
    "pos": "adv.",
    "category": "time",
    "positions": [
      "end"
    ],
    "default_position": "end",
    "modifies": [
      "verb"
    ],
    "provenance": {
      "source": "curated_by_agent",
      "reviewed": true,
      "confidence": "high",
      "checked_at": "2026-07-30"
    }
  },
  {
    "spelling": "ahead",
    "pos": "adv.",
    "category": "place",
    "positions": [
      "end"
    ],
    "default_position": "end",
    "modifies": [
      "verb"
    ],
    "provenance": {
      "source": "curated_by_agent",
      "reviewed": true,
      "confidence": "high",
      "checked_at": "2026-07-30"
    }
  },
  {
    "spelling": "almost",
    "pos": "adv.",
    "category": "degree",
    "positions": [
      "mid"
    ],
    "default_position": "mid",
    "modifies": [
      "verb",
      "adjective",
      "adverb"
    ],
    "provenance": {
      "source": "curated_by_agent",
      "reviewed": true,
      "confidence": "high",
      "checked_at": "2026-07-30"
    }
  },
  {
    "spelling": "already",
    "pos": "adv.",
    "category": "time",
    "positions": [
      "mid",
      "end"
    ],
    "default_position": "mid",
    "modifies": [
      "verb"
    ],
    "notes": "多用于肯定/完成时",
    "provenance": {
      "source": "curated_by_agent",
      "reviewed": true,
      "confidence": "high",
      "checked_at": "2026-07-30"
    }
  },
  {
    "spelling": "also",
    "pos": "adv.",
    "category": "comment",
    "positions": [
      "mid"
    ],
    "default_position": "mid",
    "modifies": [
      "sentence"
    ],
    "provenance": {
      "source": "curated_by_agent",
      "reviewed": true,
      "confidence": "high",
      "checked_at": "2026-07-30"
    }
  },
  {
    "spelling": "always",
    "pos": "adv.",
    "category": "frequency",
    "positions": [
      "mid"
    ],
    "default_position": "mid",
    "modifies": [
      "verb"
    ],
    "provenance": {
      "source": "curated_by_agent",
      "reviewed": true,
      "confidence": "high",
      "checked_at": "2026-07-30"
    }
  },
  {
    "spelling": "away",
    "pos": "adv.",
    "category": "place",
    "positions": [
      "end"
    ],
    "default_position": "end",
    "modifies": [
      "verb"
    ],
    "provenance": {
      "source": "curated_by_agent",
      "reviewed": true,
      "confidence": "high",
      "checked_at": "2026-07-30"
    }
  },
  {
    "spelling": "badly",
    "pos": "adv.",
    "category": "manner",
    "positions": [
      "end"
    ],
    "default_position": "end",
    "modifies": [
      "verb"
    ],
    "provenance": {
      "source": "curated_by_agent",
      "reviewed": true,
      "confidence": "high",
      "checked_at": "2026-07-30"
    }
  },
  {
    "spelling": "carefully",
    "pos": "adv.",
    "category": "manner",
    "positions": [
      "mid",
      "end"
    ],
    "default_position": "end",
    "modifies": [
      "verb"
    ],
    "provenance": {
      "source": "curated_by_agent",
      "reviewed": true,
      "confidence": "high",
      "checked_at": "2026-07-30"
    }
  },
  {
    "spelling": "easily",
    "pos": "adv.",
    "category": "manner",
    "positions": [
      "mid",
      "end"
    ],
    "default_position": "end",
    "modifies": [
      "verb"
    ],
    "provenance": {
      "source": "curated_by_agent",
      "reviewed": true,
      "confidence": "high",
      "checked_at": "2026-07-30"
    }
  },
  {
    "spelling": "enough",
    "pos": "adv.",
    "category": "degree",
    "positions": [
      "end"
    ],
    "default_position": "end",
    "modifies": [
      "adjective",
      "adverb"
    ],
    "notes": "唯一后置的程度副词：good enough，*enough good",
    "provenance": {
      "source": "curated_by_agent",
      "reviewed": true,
      "confidence": "high",
      "checked_at": "2026-07-30"
    }
  },
  {
    "spelling": "even",
    "pos": "adv.",
    "category": "comment",
    "positions": [
      "mid"
    ],
    "default_position": "mid",
    "modifies": [
      "sentence"
    ],
    "provenance": {
      "source": "curated_by_agent",
      "reviewed": true,
      "confidence": "high",
      "checked_at": "2026-07-30"
    }
  },
  {
    "spelling": "ever",
    "pos": "adv.",
    "category": "frequency",
    "positions": [
      "mid"
    ],
    "default_position": "mid",
    "modifies": [
      "verb"
    ],
    "notes": "限疑问/否定/完成时",
    "provenance": {
      "source": "curated_by_agent",
      "reviewed": true,
      "confidence": "high",
      "checked_at": "2026-07-30"
    }
  },
  {
    "spelling": "fast",
    "pos": "adv.",
    "category": "manner",
    "positions": [
      "end"
    ],
    "default_position": "end",
    "modifies": [
      "verb"
    ],
    "notes": "形副同形：run fast",
    "provenance": {
      "source": "curated_by_agent",
      "reviewed": true,
      "confidence": "high",
      "checked_at": "2026-07-30"
    }
  },
  {
    "spelling": "happily",
    "pos": "adv.",
    "category": "manner",
    "positions": [
      "mid",
      "end"
    ],
    "default_position": "end",
    "modifies": [
      "verb"
    ],
    "provenance": {
      "source": "curated_by_agent",
      "reviewed": true,
      "confidence": "high",
      "checked_at": "2026-07-30"
    }
  },
  {
    "spelling": "hard",
    "pos": "adv.",
    "category": "manner",
    "positions": [
      "end"
    ],
    "default_position": "end",
    "modifies": [
      "verb"
    ],
    "notes": "形副同形：work hard；hardly 是另一个词",
    "provenance": {
      "source": "curated_by_agent",
      "reviewed": true,
      "confidence": "high",
      "checked_at": "2026-07-30"
    }
  },
  {
    "spelling": "hardly",
    "pos": "adv.",
    "category": "frequency",
    "positions": [
      "mid"
    ],
    "default_position": "mid",
    "modifies": [
      "verb"
    ],
    "notes": "自带否定义：hardly ever",
    "provenance": {
      "source": "curated_by_agent",
      "reviewed": true,
      "confidence": "high",
      "checked_at": "2026-07-30"
    }
  },
  {
    "spelling": "here",
    "pos": "adv.",
    "category": "place",
    "positions": [
      "front",
      "end"
    ],
    "default_position": "end",
    "modifies": [
      "sentence"
    ],
    "notes": "无介词：come here",
    "provenance": {
      "source": "curated_by_agent",
      "reviewed": true,
      "confidence": "high",
      "checked_at": "2026-07-30"
    }
  },
  {
    "spelling": "however",
    "pos": "adv.",
    "category": "comment",
    "positions": [
      "front"
    ],
    "default_position": "front",
    "modifies": [
      "sentence"
    ],
    "notes": "句首需逗号",
    "provenance": {
      "source": "curated_by_agent",
      "reviewed": true,
      "confidence": "high",
      "checked_at": "2026-07-30"
    }
  },
  {
    "spelling": "just",
    "pos": "adv.",
    "category": "time",
    "positions": [
      "mid"
    ],
    "default_position": "mid",
    "modifies": [
      "verb"
    ],
    "notes": "完成时常用：have just done",
    "provenance": {
      "source": "curated_by_agent",
      "reviewed": true,
      "confidence": "high",
      "checked_at": "2026-07-30"
    }
  },
  {
    "spelling": "loudly",
    "pos": "adv.",
    "category": "manner",
    "positions": [
      "mid",
      "end"
    ],
    "default_position": "end",
    "modifies": [
      "verb"
    ],
    "provenance": {
      "source": "curated_by_agent",
      "reviewed": true,
      "confidence": "high",
      "checked_at": "2026-07-30"
    }
  },
  {
    "spelling": "maybe",
    "pos": "adv.",
    "category": "comment",
    "positions": [
      "front"
    ],
    "default_position": "front",
    "modifies": [
      "sentence"
    ],
    "provenance": {
      "source": "curated_by_agent",
      "reviewed": true,
      "confidence": "high",
      "checked_at": "2026-07-30"
    }
  },
  {
    "spelling": "never",
    "pos": "adv.",
    "category": "frequency",
    "positions": [
      "mid"
    ],
    "default_position": "mid",
    "modifies": [
      "verb"
    ],
    "notes": "自带否定义，不与 not 连用",
    "provenance": {
      "source": "curated_by_agent",
      "reviewed": true,
      "confidence": "high",
      "checked_at": "2026-07-30"
    }
  },
  {
    "spelling": "now",
    "pos": "adv.",
    "category": "time",
    "positions": [
      "front",
      "mid",
      "end"
    ],
    "default_position": "end",
    "modifies": [
      "sentence"
    ],
    "provenance": {
      "source": "curated_by_agent",
      "reviewed": true,
      "confidence": "high",
      "checked_at": "2026-07-30"
    }
  },
  {
    "spelling": "often",
    "pos": "adv.",
    "category": "frequency",
    "positions": [
      "mid",
      "end"
    ],
    "default_position": "mid",
    "modifies": [
      "verb"
    ],
    "provenance": {
      "source": "curated_by_agent",
      "reviewed": true,
      "confidence": "high",
      "checked_at": "2026-07-30"
    }
  },
  {
    "spelling": "only",
    "pos": "adv.",
    "category": "comment",
    "positions": [
      "mid"
    ],
    "default_position": "mid",
    "modifies": [
      "sentence"
    ],
    "notes": "位置影响辖域，默认中位",
    "provenance": {
      "source": "curated_by_agent",
      "reviewed": true,
      "confidence": "high",
      "checked_at": "2026-07-30"
    }
  },
  {
    "spelling": "perhaps",
    "pos": "adv.",
    "category": "comment",
    "positions": [
      "front"
    ],
    "default_position": "front",
    "modifies": [
      "sentence"
    ],
    "provenance": {
      "source": "curated_by_agent",
      "reviewed": true,
      "confidence": "high",
      "checked_at": "2026-07-30"
    }
  },
  {
    "spelling": "please",
    "pos": "adv.",
    "category": "comment",
    "positions": [
      "front",
      "end"
    ],
    "default_position": "front",
    "modifies": [
      "sentence"
    ],
    "notes": "祈使句礼貌标记",
    "provenance": {
      "source": "curated_by_agent",
      "reviewed": true,
      "confidence": "high",
      "checked_at": "2026-07-30"
    }
  },
  {